No.     Time           Source                Destination           Protocol Length Info
      7 0.024589000    10.0.0.13             10.0.0.40             HTTP     289    POST / HTTP/1.1 

Frame 7: 289 bytes on wire (2312 bits), 289 bytes captured (2312 bits) on interface 1
Ethernet II, Src: CadmusCo_93:05:23 (08:00:27:93:05:23), Dst: AsustekC_6d:7f:57 (c8:60:00:6d:7f:57)
Internet Protocol Version 4, Src: 10.0.0.13 (10.0.0.13), Dst: 10.0.0.40 (10.0.0.40)
Transmission Control Protocol, Src Port: 36460 (36460), Dst Port: 9333 (9333), Seq: 1, Ack: 1, Len: 223
    Source port: 36460 (36460)
    Destination port: 9333 (9333)
    [Stream index: 0]
    Sequence number: 1    (relative sequence number)
    [Next sequence number: 224    (relative sequence number)]
    Acknowledgment number: 1    (relative ack number)
    Header length: 32 bytes
    Flags: 0x018 (PSH, ACK)
    Window size value: 229
    [Calculated window size: 29312]
    [Window size scaling factor: 128]
    Checksum: 0xebc8 [validation disabled]
    Options: (12 bytes), No-Operation (NOP), No-Operation (NOP), Timestamps
    [SEQ/ACK analysis]
Hypertext Transfer Protocol
    POST / HTTP/1.1\r\n
    Content-Length: 95\r\n
    Host: 10.0.0.40:9333\r\n
    Authorization: Basic dXNlcjpwYXNzd29yZA==\r\n
    Connection: keep-alive\r\n
    \r\n
    [Full request URI: http://10.0.0.40:9333/]
    [HTTP request 1/1]
    [Response in frame: 9]
    Data (95 bytes)

0000  7b 22 6d 65 74 68 6f 64 22 3a 22 76 61 6c 69 64   {"method":"valid
0010  61 74 65 61 64 64 72 65 73 73 22 2c 22 70 61 72   ateaddress","par
0020  61 6d 73 22 3a 5b 22 6d 6b 38 4a 71 4e 31 6b 4e   ams":["mk8JqN1kN
0030  57 6a 75 38 6f 33 44 58 45 69 6a 69 4a 79 6e 37   Wju8o3DXEijiJyn7
0040  69 71 6b 77 6b 74 41 57 71 22 5d 2c 22 69 64 22   iqkwktAWq"],"id"
0050  3a 31 34 30 31 31 38 35 39 33 30 31 31 32 7d      :1401185930112}

No.     Time           Source                Destination           Protocol Length Info
      8 0.024689000    10.0.0.13             10.0.0.40             HTTP     248    POST / HTTP/1.1 

Frame 8: 248 bytes on wire (1984 bits), 248 bytes captured (1984 bits) on interface 1
Ethernet II, Src: CadmusCo_93:05:23 (08:00:27:93:05:23), Dst: AsustekC_6d:7f:57 (c8:60:00:6d:7f:57)
Internet Protocol Version 4, Src: 10.0.0.13 (10.0.0.13), Dst: 10.0.0.40 (10.0.0.40)
Transmission Control Protocol, Src Port: 36461 (36461), Dst Port: 9333 (9333), Seq: 1, Ack: 1, Len: 182
    Source port: 36461 (36461)
    Destination port: 9333 (9333)
    [Stream index: 1]
    Sequence number: 1    (relative sequence number)
    [Next sequence number: 183    (relative sequence number)]
    Acknowledgment number: 1    (relative ack number)
    Header length: 32 bytes
    Flags: 0x018 (PSH, ACK)
    Window size value: 229
    [Calculated window size: 29312]
    [Window size scaling factor: 128]
    Checksum: 0xc39b [validation disabled]
    Options: (12 bytes), No-Operation (NOP), No-Operation (NOP), Timestamps
    [SEQ/ACK analysis]
Hypertext Transfer Protocol
    POST / HTTP/1.1\r\n
    Content-Length: 54\r\n
    Host: 10.0.0.40:9333\r\n
    Authorization: Basic dXNlcjpwYXNzd29yZA==\r\n
    Connection: keep-alive\r\n
    \r\n
    [Full request URI: http://10.0.0.40:9333/]
    [HTTP request 1/1]
    [Response in frame: 10]
    Data (54 bytes)

0000  7b 22 6d 65 74 68 6f 64 22 3a 22 67 65 74 62 61   {"method":"getba
0010  6c 61 6e 63 65 22 2c 22 70 61 72 61 6d 73 22 3a   lance","params":
0020  5b 5d 2c 22 69 64 22 3a 31 34 30 31 31 38 35 39   [],"id":14011859
0030  33 30 31 31 33 7d                                 30113}

No.     Time           Source                Destination           Protocol Length Info
      9 0.025687000    10.0.0.40             10.0.0.13             HTTP     502    HTTP/1.1 200 OK  (application/json)

Frame 9: 502 bytes on wire (4016 bits), 502 bytes captured (4016 bits) on interface 1
Ethernet II, Src: AsustekC_6d:7f:57 (c8:60:00:6d:7f:57), Dst: CadmusCo_93:05:23 (08:00:27:93:05:23)
Internet Protocol Version 4, Src: 10.0.0.40 (10.0.0.40), Dst: 10.0.0.13 (10.0.0.13)
Transmission Control Protocol, Src Port: 9333 (9333), Dst Port: 36460 (36460), Seq: 1, Ack: 224, Len: 436
    Source port: 9333 (9333)
    Destination port: 36460 (36460)
    [Stream index: 0]
    Sequence number: 1    (relative sequence number)
    [Next sequence number: 437    (relative sequence number)]
    Acknowledgment number: 224    (relative ack number)
    Header length: 32 bytes
    Flags: 0x018 (PSH, ACK)
    Window size value: 260
    [Calculated window size: 66560]
    [Window size scaling factor: 256]
    Checksum: 0xa54b [validation disabled]
    Options: (12 bytes), No-Operation (NOP), No-Operation (NOP), Timestamps
    [SEQ/ACK analysis]
Hypertext Transfer Protocol
    HTTP/1.1 200 OK\r\n
    Date: Tue, 27 May 2014 10:18:50 +0000\r\n
    Connection: keep-alive\r\n
    Content-Length: 260\r\n
    Content-Type: application/json\r\n
    Server: litecoin-json-rpc/v0.8.6.2-beta\r\n
    \r\n
    [HTTP response 1/1]
    [Time since request: 0.001098000 seconds]
    [Request in frame: 7]
JavaScript Object Notation: application/json

No.     Time           Source                Destination           Protocol Length Info
     10 0.025967000    10.0.0.40             10.0.0.13             HTTP     298    HTTP/1.1 200 OK  (application/json)

Frame 10: 298 bytes on wire (2384 bits), 298 bytes captured (2384 bits) on interface 1
Ethernet II, Src: AsustekC_6d:7f:57 (c8:60:00:6d:7f:57), Dst: CadmusCo_93:05:23 (08:00:27:93:05:23)
Internet Protocol Version 4, Src: 10.0.0.40 (10.0.0.40), Dst: 10.0.0.13 (10.0.0.13)
Transmission Control Protocol, Src Port: 9333 (9333), Dst Port: 36461 (36461), Seq: 1, Ack: 183, Len: 232
    Source port: 9333 (9333)
    Destination port: 36461 (36461)
    [Stream index: 1]
    Sequence number: 1    (relative sequence number)
    [Next sequence number: 233    (relative sequence number)]
    Acknowledgment number: 183    (relative ack number)
    Header length: 32 bytes
    Flags: 0x018 (PSH, ACK)
    Window size value: 260
    [Calculated window size: 66560]
    [Window size scaling factor: 256]
    Checksum: 0xf45b [validation disabled]
    Options: (12 bytes), No-Operation (NOP), No-Operation (NOP), Timestamps
    [SEQ/ACK analysis]
Hypertext Transfer Protocol
    HTTP/1.1 200 OK\r\n
    Date: Tue, 27 May 2014 10:18:50 +0000\r\n
    Connection: keep-alive\r\n
    Content-Length: 57\r\n
    Content-Type: application/json\r\n
    Server: litecoin-json-rpc/v0.8.6.2-beta\r\n
    \r\n
    [HTTP response 1/1]
    [Time since request: 0.001278000 seconds]
    [Request in frame: 8]
JavaScript Object Notation: application/json

No.     Time           Source                Destination           Protocol Length Info
     24 0.164256000    10.0.0.13             10.0.0.40             HTTP     1413   POST / HTTP/1.1 

Frame 24: 1413 bytes on wire (11304 bits), 1413 bytes captured (11304 bits) on interface 1
Ethernet II, Src: CadmusCo_93:05:23 (08:00:27:93:05:23), Dst: AsustekC_6d:7f:57 (c8:60:00:6d:7f:57)
Internet Protocol Version 4, Src: 10.0.0.13 (10.0.0.13), Dst: 10.0.0.40 (10.0.0.40)
Transmission Control Protocol, Src Port: 36465 (36465), Dst Port: 9333 (9333), Seq: 1, Ack: 1, Len: 1347
    Source port: 36465 (36465)
    Destination port: 9333 (9333)
    [Stream index: 2]
    Sequence number: 1    (relative sequence number)
    [Next sequence number: 1348    (relative sequence number)]
    Acknowledgment number: 1    (relative ack number)
    Header length: 32 bytes
    Flags: 0x018 (PSH, ACK)
    Window size value: 229
    [Calculated window size: 29312]
    [Window size scaling factor: 128]
    Checksum: 0xe546 [validation disabled]
    Options: (12 bytes), No-Operation (NOP), No-Operation (NOP), Timestamps
    [SEQ/ACK analysis]
Hypertext Transfer Protocol
    POST / HTTP/1.1\r\n
    Content-Length: 1217\r\n
    Host: 10.0.0.40:9333\r\n
    Authorization: Basic dXNlcjpwYXNzd29yZA==\r\n
    Connection: keep-alive\r\n
    \r\n
    [Full request URI: http://10.0.0.40:9333/]
    [HTTP request 1/1]
    [Response in frame: 29]
    Data (1217 bytes)

0000  5b 7b 22 6d 65 74 68 6f 64 22 3a 22 67 65 74 74   [{"method":"gett
0010  72 61 6e 73 61 63 74 69 6f 6e 22 2c 22 70 61 72   ransaction","par
0020  61 6d 73 22 3a 5b 22 30 36 64 64 34 63 34 35 35   ams":["06dd4c455
0030  34 36 64 62 33 65 35 63 66 38 64 39 36 63 39 65   46db3e5cf8d96c9e
0040  65 34 36 36 66 64 39 31 34 66 37 33 31 32 63 39   e466fd914f7312c9
0050  30 34 39 30 66 35 31 38 64 63 38 63 38 37 35 35   0490f518dc8c8755
0060  64 33 64 36 61 64 39 22 5d 2c 22 69 64 22 3a 31   d3d6ad9"],"id":1
0070  34 30 31 31 38 35 39 33 30 32 38 39 7d 2c 7b 22   401185930289},{"
0080  6d 65 74 68 6f 64 22 3a 22 67 65 74 74 72 61 6e   method":"gettran
0090  73 61 63 74 69 6f 6e 22 2c 22 70 61 72 61 6d 73   saction","params
00a0  22 3a 5b 22 64 63 63 31 66 34 63 61 35 35 38 39   ":["dcc1f4ca5589
00b0  34 33 33 66 63 38 30 34 31 30 30 36 32 64 32 63   433fc80410062d2c
00c0  61 38 36 61 38 32 35 34 39 66 33 31 38 36 38 65   a86a82549f31868e
00d0  38 38 39 62 37 31 32 31 65 62 34 35 63 36 66 35   889b7121eb45c6f5
00e0  39 36 33 31 22 5d 2c 22 69 64 22 3a 31 34 30 31   9631"],"id":1401
00f0  31 38 35 39 33 30 32 38 39 7d 2c 7b 22 6d 65 74   185930289},{"met
0100  68 6f 64 22 3a 22 67 65 74 74 72 61 6e 73 61 63   hod":"gettransac
0110  74 69 6f 6e 22 2c 22 70 61 72 61 6d 73 22 3a 5b   tion","params":[
0120  22 39 39 65 64 31 31 63 66 35 32 36 35 62 61 31   "99ed11cf5265ba1
0130  65 33 38 65 31 32 33 36 30 66 31 64 30 61 66 62   e38e12360f1d0afb
0140  66 31 65 38 38 63 63 32 64 61 33 63 34 35 38 62   f1e88cc2da3c458b
0150  61 38 33 36 62 31 66 38 39 36 38 61 37 34 37 64   a836b1f8968a747d
0160  33 22 5d 2c 22 69 64 22 3a 31 34 30 31 31 38 35   3"],"id":1401185
0170  39 33 30 32 39 32 7d 2c 7b 22 6d 65 74 68 6f 64   930292},{"method
0180  22 3a 22 67 65 74 74 72 61 6e 73 61 63 74 69 6f   ":"gettransactio
0190  6e 22 2c 22 70 61 72 61 6d 73 22 3a 5b 22 36 34   n","params":["64
01a0  63 63 31 63 39 31 63 63 62 37 65 36 66 65 30 37   cc1c91ccb7e6fe07
01b0  62 35 37 32 63 61 61 62 38 30 33 37 39 37 65 63   b572caab803797ec
01c0  37 65 62 31 66 61 30 33 61 32 34 31 31 64 35 30   7eb1fa03a2411d50
01d0  35 33 37 34 31 37 37 30 63 36 61 34 62 31 22 5d   53741770c6a4b1"]
01e0  2c 22 69 64 22 3a 31 34 30 31 31 38 35 39 33 30   ,"id":1401185930
01f0  32 39 31 7d 2c 7b 22 6d 65 74 68 6f 64 22 3a 22   291},{"method":"
0200  67 65 74 74 72 61 6e 73 61 63 74 69 6f 6e 22 2c   gettransaction",
0210  22 70 61 72 61 6d 73 22 3a 5b 22 30 36 36 37 36   "params":["06676
0220  37 35 33 61 39 30 38 64 64 30 30 63 62 36 38 61   753a908dd00cb68a
0230  31 33 33 61 65 64 38 61 63 62 38 35 35 33 62 38   133aed8acb8553b8
0240  36 36 33 63 61 63 35 34 34 61 35 38 63 32 61 34   663cac544a58c2a4
0250  35 35 65 32 30 66 65 66 62 65 61 22 5d 2c 22 69   55e20fefbea"],"i
0260  64 22 3a 31 34 30 31 31 38 35 39 33 30 32 39 33   d":1401185930293
0270  7d 2c 7b 22 6d 65 74 68 6f 64 22 3a 22 67 65 74   },{"method":"get
0280  74 72 61 6e 73 61 63 74 69 6f 6e 22 2c 22 70 61   transaction","pa
0290  72 61 6d 73 22 3a 5b 22 38 32 31 32 30 34 61 61   rams":["821204aa
02a0  62 34 63 33 37 64 65 35 34 33 64 37 30 32 33 36   b4c37de543d70236
02b0  37 62 33 31 64 62 62 39 34 37 35 32 32 33 33 33   7b31dbb947522333
02c0  39 63 61 38 38 65 38 63 61 35 35 61 32 36 34 64   9ca88e8ca55a264d
02d0  65 32 32 61 39 39 39 63 22 5d 2c 22 69 64 22 3a   e22a999c"],"id":
02e0  31 34 30 31 31 38 35 39 33 30 32 39 32 7d 2c 7b   1401185930292},{
02f0  22 6d 65 74 68 6f 64 22 3a 22 67 65 74 74 72 61   "method":"gettra
0300  6e 73 61 63 74 69 6f 6e 22 2c 22 70 61 72 61 6d   nsaction","param
0310  73 22 3a 5b 22 32 30 62 35 38 39 34 36 35 61 65   s":["20b589465ae
0320  63 61 35 37 64 32 63 32 35 35 30 33 62 33 30 66   ca57d2c25503b30f
0330  33 31 33 63 35 39 33 37 36 63 39 32 33 34 63 37   313c59376c9234c7
0340  34 37 36 64 32 35 30 66 30 63 30 32 30 62 64 66   476d250f0c020bdf
0350  31 34 30 38 38 22 5d 2c 22 69 64 22 3a 31 34 30   14088"],"id":140
0360  31 31 38 35 39 33 30 32 38 39 7d 2c 7b 22 6d 65   1185930289},{"me
0370  74 68 6f 64 22 3a 22 67 65 74 74 72 61 6e 73 61   thod":"gettransa
0380  63 74 69 6f 6e 22 2c 22 70 61 72 61 6d 73 22 3a   ction","params":
0390  5b 22 30 32 39 63 34 63 63 31 66 31 64 65 65 64   ["029c4cc1f1deed
03a0  66 31 63 61 37 37 36 33 37 64 35 61 62 66 32 35   f1ca77637d5abf25
03b0  39 38 63 33 35 30 30 35 33 62 65 33 62 64 62 61   98c350053be3bdba
03c0  32 33 61 34 62 30 34 30 66 64 34 62 36 64 64 36   23a4b040fd4b6dd6
03d0  65 65 22 5d 2c 22 69 64 22 3a 31 34 30 31 31 38   ee"],"id":140118
03e0  35 39 33 30 32 38 38 7d 2c 7b 22 6d 65 74 68 6f   5930288},{"metho
03f0  64 22 3a 22 67 65 74 74 72 61 6e 73 61 63 74 69   d":"gettransacti
0400  6f 6e 22 2c 22 70 61 72 61 6d 73 22 3a 5b 22 35   on","params":["5
0410  39 35 62 63 64 37 33 35 66 32 39 65 35 37 33 65   95bcd735f29e573e
0420  38 35 33 66 34 31 65 63 31 32 34 32 63 38 36 36   853f41ec1242c866
0430  39 61 37 63 61 33 30 39 38 61 61 65 34 61 36 62   9a7ca3098aae4a6b
0440  39 35 31 64 64 63 37 64 37 31 66 35 35 38 39 22   951ddc7d71f5589"
0450  5d 2c 22 69 64 22 3a 31 34 30 31 31 38 35 39 33   ],"id":140118593
0460  30 32 39 37 7d 2c 7b 22 6d 65 74 68 6f 64 22 3a   0297},{"method":
0470  22 67 65 74 61 63 63 6f 75 6e 74 22 2c 22 70 61   "getaccount","pa
0480  72 61 6d 73 22 3a 5b 22 6d 6b 38 4a 71 4e 31 6b   rams":["mk8JqN1k
0490  4e 57 6a 75 38 6f 33 44 58 45 69 6a 69 4a 79 6e   NWju8o3DXEijiJyn
04a0  37 69 71 6b 77 6b 74 41 57 71 22 5d 2c 22 69 64   7iqkwktAWq"],"id
04b0  22 3a 31 34 30 31 31 38 35 39 33 30 32 39 37 7d   ":1401185930297}
04c0  5d                                                ]

No.     Time           Source                Destination           Protocol Length Info
     25 0.167571000    10.0.0.40             10.0.0.13             TCP      1514   [TCP segment of a reassembled PDU]

Frame 25: 1514 bytes on wire (12112 bits), 1514 bytes captured (12112 bits) on interface 1
Ethernet II, Src: AsustekC_6d:7f:57 (c8:60:00:6d:7f:57), Dst: CadmusCo_93:05:23 (08:00:27:93:05:23)
Internet Protocol Version 4, Src: 10.0.0.40 (10.0.0.40), Dst: 10.0.0.13 (10.0.0.13)
Transmission Control Protocol, Src Port: 9333 (9333), Dst Port: 36465 (36465), Seq: 1, Ack: 1348, Len: 1448
    Source port: 9333 (9333)
    Destination port: 36465 (36465)
    [Stream index: 2]
    Sequence number: 1    (relative sequence number)
    [Next sequence number: 1449    (relative sequence number)]
    Acknowledgment number: 1348    (relative ack number)
    Header length: 32 bytes
    Flags: 0x010 (ACK)
    Window size value: 260
    [Calculated window size: 66560]
    [Window size scaling factor: 256]
    Checksum: 0xe81b [validation disabled]
    Options: (12 bytes), No-Operation (NOP), No-Operation (NOP), Timestamps
    [SEQ/ACK analysis]
    TCP segment data (1448 bytes)

No.     Time           Source                Destination           Protocol Length Info
     26 0.167587000    10.0.0.40             10.0.0.13             TCP      1514   [TCP segment of a reassembled PDU]

Frame 26: 1514 bytes on wire (12112 bits), 1514 bytes captured (12112 bits) on interface 1
Ethernet II, Src: AsustekC_6d:7f:57 (c8:60:00:6d:7f:57), Dst: CadmusCo_93:05:23 (08:00:27:93:05:23)
Internet Protocol Version 4, Src: 10.0.0.40 (10.0.0.40), Dst: 10.0.0.13 (10.0.0.13)
Transmission Control Protocol, Src Port: 9333 (9333), Dst Port: 36465 (36465), Seq: 1449, Ack: 1348, Len: 1448
    Source port: 9333 (9333)
    Destination port: 36465 (36465)
    [Stream index: 2]
    Sequence number: 1449    (relative sequence number)
    [Next sequence number: 2897    (relative sequence number)]
    Acknowledgment number: 1348    (relative ack number)
    Header length: 32 bytes
    Flags: 0x010 (ACK)
    Window size value: 260
    [Calculated window size: 66560]
    [Window size scaling factor: 256]
    Checksum: 0x6948 [validation disabled]
    Options: (12 bytes), No-Operation (NOP), No-Operation (NOP), Timestamps
    [SEQ/ACK analysis]
    [Reassembled PDU in frame: 29]
    TCP segment data (1448 bytes)

No.     Time           Source                Destination           Protocol Length Info
     27 0.167600000    10.0.0.40             10.0.0.13             TCP      1266   [TCP segment of a reassembled PDU]

Frame 27: 1266 bytes on wire (10128 bits), 1266 bytes captured (10128 bits) on interface 1
Ethernet II, Src: AsustekC_6d:7f:57 (c8:60:00:6d:7f:57), Dst: CadmusCo_93:05:23 (08:00:27:93:05:23)
Internet Protocol Version 4, Src: 10.0.0.40 (10.0.0.40), Dst: 10.0.0.13 (10.0.0.13)
Transmission Control Protocol, Src Port: 9333 (9333), Dst Port: 36465 (36465), Seq: 2897, Ack: 1348, Len: 1200
    Source port: 9333 (9333)
    Destination port: 36465 (36465)
    [Stream index: 2]
    Sequence number: 2897    (relative sequence number)
    [Next sequence number: 4097    (relative sequence number)]
    Acknowledgment number: 1348    (relative ack number)
    Header length: 32 bytes
    Flags: 0x018 (PSH, ACK)
    Window size value: 260
    [Calculated window size: 66560]
    [Window size scaling factor: 256]
    Checksum: 0x0c51 [validation disabled]
    Options: (12 bytes), No-Operation (NOP), No-Operation (NOP), Timestamps
    [SEQ/ACK analysis]
    [Reassembled PDU in frame: 29]
    TCP segment data (1200 bytes)

No.     Time           Source                Destination           Protocol Length Info
     29 0.168115000    10.0.0.40             10.0.0.13             HTTP     1389   HTTP/1.1 200 OK  (application/json)

Frame 29: 1389 bytes on wire (11112 bits), 1389 bytes captured (11112 bits) on interface 1
Ethernet II, Src: AsustekC_6d:7f:57 (c8:60:00:6d:7f:57), Dst: CadmusCo_93:05:23 (08:00:27:93:05:23)
Internet Protocol Version 4, Src: 10.0.0.40 (10.0.0.40), Dst: 10.0.0.13 (10.0.0.13)
Transmission Control Protocol, Src Port: 9333 (9333), Dst Port: 36465 (36465), Seq: 4097, Ack: 1348, Len: 1323
    Source port: 9333 (9333)
    Destination port: 36465 (36465)
    [Stream index: 2]
    Sequence number: 4097    (relative sequence number)
    [Next sequence number: 5420    (relative sequence number)]
    Acknowledgment number: 1348    (relative ack number)
    Header length: 32 bytes
    Flags: 0x018 (PSH, ACK)
    Window size value: 260
    [Calculated window size: 66560]
    [Window size scaling factor: 256]
    Checksum: 0x7e82 [validation disabled]
    Options: (12 bytes), No-Operation (NOP), No-Operation (NOP), Timestamps
    [SEQ/ACK analysis]
    TCP segment data (1323 bytes)
[4 Reassembled TCP Segments (5419 bytes): #25(1448), #26(1448), #27(1200), #29(1323)]
Hypertext Transfer Protocol
    HTTP/1.1 200 OK\r\n
    Date: Tue, 27 May 2014 10:18:50 +0000\r\n
    Connection: keep-alive\r\n
    Content-Length: 5242\r\n
    Content-Type: application/json\r\n
    Server: litecoin-json-rpc/v0.8.6.2-beta\r\n
    \r\n
    [HTTP response 1/1]
    [Time since request: 0.003859000 seconds]
    [Request in frame: 24]
JavaScript Object Notation: application/json

No.     Time           Source                Destination           Protocol Length Info
     38 0.288935000    10.0.0.13             10.0.0.40             HTTP     245    POST / HTTP/1.1 

Frame 38: 245 bytes on wire (1960 bits), 245 bytes captured (1960 bits) on interface 1
Ethernet II, Src: CadmusCo_93:05:23 (08:00:27:93:05:23), Dst: AsustekC_6d:7f:57 (c8:60:00:6d:7f:57)
Internet Protocol Version 4, Src: 10.0.0.13 (10.0.0.13), Dst: 10.0.0.40 (10.0.0.40)
Transmission Control Protocol, Src Port: 36470 (36470), Dst Port: 9333 (9333), Seq: 1, Ack: 1, Len: 179
    Source port: 36470 (36470)
    Destination port: 9333 (9333)
    [Stream index: 3]
    Sequence number: 1    (relative sequence number)
    [Next sequence number: 180    (relative sequence number)]
    Acknowledgment number: 1    (relative ack number)
    Header length: 32 bytes
    Flags: 0x018 (PSH, ACK)
    Window size value: 229
    [Calculated window size: 29312]
    [Window size scaling factor: 128]
    Checksum: 0xfffe [validation disabled]
    Options: (12 bytes), No-Operation (NOP), No-Operation (NOP), Timestamps
    [SEQ/ACK analysis]
Hypertext Transfer Protocol
    POST / HTTP/1.1\r\n
    Content-Length: 51\r\n
    Host: 10.0.0.40:9333\r\n
    Authorization: Basic dXNlcjpwYXNzd29yZA==\r\n
    Connection: keep-alive\r\n
    \r\n
    [Full request URI: http://10.0.0.40:9333/]
    [HTTP request 1/1]
    [Response in frame: 39]
    Data (51 bytes)

0000  7b 22 6d 65 74 68 6f 64 22 3a 22 67 65 74 69 6e   {"method":"getin
0010  66 6f 22 2c 22 70 61 72 61 6d 73 22 3a 5b 5d 2c   fo","params":[],
0020  22 69 64 22 3a 31 34 30 31 31 38 35 39 33 30 33   "id":14011859303
0030  39 38 7d                                          98}

No.     Time           Source                Destination           Protocol Length Info
     39 0.292791000    10.0.0.40             10.0.0.13             HTTP     571    HTTP/1.1 200 OK  (application/json)

Frame 39: 571 bytes on wire (4568 bits), 571 bytes captured (4568 bits) on interface 1
Ethernet II, Src: AsustekC_6d:7f:57 (c8:60:00:6d:7f:57), Dst: CadmusCo_93:05:23 (08:00:27:93:05:23)
Internet Protocol Version 4, Src: 10.0.0.40 (10.0.0.40), Dst: 10.0.0.13 (10.0.0.13)
Transmission Control Protocol, Src Port: 9333 (9333), Dst Port: 36470 (36470), Seq: 1, Ack: 180, Len: 505
    Source port: 9333 (9333)
    Destination port: 36470 (36470)
    [Stream index: 3]
    Sequence number: 1    (relative sequence number)
    [Next sequence number: 506    (relative sequence number)]
    Acknowledgment number: 180    (relative ack number)
    Header length: 32 bytes
    Flags: 0x018 (PSH, ACK)
    Window size value: 260
    [Calculated window size: 66560]
    [Window size scaling factor: 256]
    Checksum: 0xa457 [validation disabled]
    Options: (12 bytes), No-Operation (NOP), No-Operation (NOP), Timestamps
    [SEQ/ACK analysis]
Hypertext Transfer Protocol
    HTTP/1.1 200 OK\r\n
    Date: Tue, 27 May 2014 10:18:50 +0000\r\n
    Connection: keep-alive\r\n
    Content-Length: 329\r\n
    Content-Type: application/json\r\n
    Server: litecoin-json-rpc/v0.8.6.2-beta\r\n
    \r\n
    [HTTP response 1/1]
    [Time since request: 0.003856000 seconds]
    [Request in frame: 38]
JavaScript Object Notation: application/json

No.     Time           Source                Destination           Protocol Length Info
     48 0.305760000    10.0.0.13             10.0.0.40             HTTP     516    POST / HTTP/1.1 

Frame 48: 516 bytes on wire (4128 bits), 516 bytes captured (4128 bits) on interface 1
Ethernet II, Src: CadmusCo_93:05:23 (08:00:27:93:05:23), Dst: AsustekC_6d:7f:57 (c8:60:00:6d:7f:57)
Internet Protocol Version 4, Src: 10.0.0.13 (10.0.0.13), Dst: 10.0.0.40 (10.0.0.40)
Transmission Control Protocol, Src Port: 36472 (36472), Dst Port: 9333 (9333), Seq: 1, Ack: 1, Len: 450
    Source port: 36472 (36472)
    Destination port: 9333 (9333)
    [Stream index: 4]
    Sequence number: 1    (relative sequence number)
    [Next sequence number: 451    (relative sequence number)]
    Acknowledgment number: 1    (relative ack number)
    Header length: 32 bytes
    Flags: 0x018 (PSH, ACK)
    Window size value: 229
    [Calculated window size: 29312]
    [Window size scaling factor: 128]
    Checksum: 0x27e6 [validation disabled]
    Options: (12 bytes), No-Operation (NOP), No-Operation (NOP), Timestamps
    [SEQ/ACK analysis]
Hypertext Transfer Protocol
    POST / HTTP/1.1\r\n
    Content-Length: 321\r\n
    Host: 10.0.0.40:9333\r\n
    Authorization: Basic dXNlcjpwYXNzd29yZA==\r\n
    Connection: keep-alive\r\n
    \r\n
    [Full request URI: http://10.0.0.40:9333/]
    [HTTP request 1/1]
    [Response in frame: 49]
    Data (321 bytes)

0000  5b 7b 22 6d 65 74 68 6f 64 22 3a 22 76 61 6c 69   [{"method":"vali
0010  64 61 74 65 61 64 64 72 65 73 73 22 2c 22 70 61   dateaddress","pa
0020  72 61 6d 73 22 3a 5b 22 6d 6b 38 4a 71 4e 31 6b   rams":["mk8JqN1k
0030  4e 57 6a 75 38 6f 33 44 58 45 69 6a 69 4a 79 6e   NWju8o3DXEijiJyn
0040  37 69 71 6b 77 6b 74 41 57 71 22 5d 2c 22 69 64   7iqkwktAWq"],"id
0050  22 3a 31 34 30 31 31 38 35 39 33 30 34 32 34 7d   ":1401185930424}
0060  2c 7b 22 6d 65 74 68 6f 64 22 3a 22 67 65 74 64   ,{"method":"getd
0070  69 66 66 69 63 75 6c 74 79 22 2c 22 70 61 72 61   ifficulty","para
0080  6d 73 22 3a 5b 5d 2c 22 69 64 22 3a 31 34 30 31   ms":[],"id":1401
0090  31 38 35 39 33 30 34 32 36 7d 2c 7b 22 6d 65 74   185930426},{"met
00a0  68 6f 64 22 3a 22 67 65 74 69 6e 66 6f 22 2c 22   hod":"getinfo","
00b0  70 61 72 61 6d 73 22 3a 5b 5d 2c 22 69 64 22 3a   params":[],"id":
00c0  31 34 30 31 31 38 35 39 33 30 34 32 37 7d 2c 7b   1401185930427},{
00d0  22 6d 65 74 68 6f 64 22 3a 22 67 65 74 6d 69 6e   "method":"getmin
00e0  69 6e 67 69 6e 66 6f 22 2c 22 70 61 72 61 6d 73   inginfo","params
00f0  22 3a 5b 5d 2c 22 69 64 22 3a 31 34 30 31 31 38   ":[],"id":140118
0100  35 39 33 30 34 33 30 7d 2c 7b 22 6d 65 74 68 6f   5930430},{"metho
0110  64 22 3a 22 73 75 62 6d 69 74 62 6c 6f 63 6b 22   d":"submitblock"
0120  2c 22 70 61 72 61 6d 73 22 3a 5b 5d 2c 22 69 64   ,"params":[],"id
0130  22 3a 31 34 30 31 31 38 35 39 33 30 34 32 38 7d   ":1401185930428}
0140  5d                                                ]

No.     Time           Source                Destination           Protocol Length Info
     49 0.308248000    10.0.0.40             10.0.0.13             HTTP     1404   HTTP/1.1 200 OK  (application/json)

Frame 49: 1404 bytes on wire (11232 bits), 1404 bytes captured (11232 bits) on interface 1
Ethernet II, Src: AsustekC_6d:7f:57 (c8:60:00:6d:7f:57), Dst: CadmusCo_93:05:23 (08:00:27:93:05:23)
Internet Protocol Version 4, Src: 10.0.0.40 (10.0.0.40), Dst: 10.0.0.13 (10.0.0.13)
Transmission Control Protocol, Src Port: 9333 (9333), Dst Port: 36472 (36472), Seq: 1, Ack: 451, Len: 1338
    Source port: 9333 (9333)
    Destination port: 36472 (36472)
    [Stream index: 4]
    Sequence number: 1    (relative sequence number)
    [Next sequence number: 1339    (relative sequence number)]
    Acknowledgment number: 451    (relative ack number)
    Header length: 32 bytes
    Flags: 0x018 (PSH, ACK)
    Window size value: 260
    [Calculated window size: 66560]
    [Window size scaling factor: 256]
    Checksum: 0x1962 [validation disabled]
    Options: (12 bytes), No-Operation (NOP), No-Operation (NOP), Timestamps
    [SEQ/ACK analysis]
Hypertext Transfer Protocol
    HTTP/1.1 200 OK\r\n
    Date: Tue, 27 May 2014 10:18:50 +0000\r\n
    Connection: keep-alive\r\n
    Content-Length: 1161\r\n
    Content-Type: application/json\r\n
    Server: litecoin-json-rpc/v0.8.6.2-beta\r\n
    \r\n
    [HTTP response 1/1]
    [Time since request: 0.002488000 seconds]
    [Request in frame: 48]
JavaScript Object Notation: application/json

No.     Time           Source                Destination           Protocol Length Info
     58 0.318874000    10.0.0.13             10.0.0.40             HTTP     254    POST / HTTP/1.1 

Frame 58: 254 bytes on wire (2032 bits), 254 bytes captured (2032 bits) on interface 1
Ethernet II, Src: CadmusCo_93:05:23 (08:00:27:93:05:23), Dst: AsustekC_6d:7f:57 (c8:60:00:6d:7f:57)
Internet Protocol Version 4, Src: 10.0.0.13 (10.0.0.13), Dst: 10.0.0.40 (10.0.0.40)
Transmission Control Protocol, Src Port: 36473 (36473), Dst Port: 9333 (9333), Seq: 1, Ack: 1, Len: 188
    Source port: 36473 (36473)
    Destination port: 9333 (9333)
    [Stream index: 5]
    Sequence number: 1    (relative sequence number)
    [Next sequence number: 189    (relative sequence number)]
    Acknowledgment number: 1    (relative ack number)
    Header length: 32 bytes
    Flags: 0x018 (PSH, ACK)
    Window size value: 229
    [Calculated window size: 29312]
    [Window size scaling factor: 128]
    Checksum: 0x1f19 [validation disabled]
    Options: (12 bytes), No-Operation (NOP), No-Operation (NOP), Timestamps
    [SEQ/ACK analysis]
Hypertext Transfer Protocol
    POST / HTTP/1.1\r\n
    Content-Length: 60\r\n
    Host: 10.0.0.40:9333\r\n
    Authorization: Basic dXNlcjpwYXNzd29yZA==\r\n
    Connection: keep-alive\r\n
    \r\n
    [Full request URI: http://10.0.0.40:9333/]
    [HTTP request 1/1]
    [Response in frame: 60]
    Data (60 bytes)

0000  7b 22 6d 65 74 68 6f 64 22 3a 22 67 65 74 62 6c   {"method":"getbl
0010  6f 63 6b 74 65 6d 70 6c 61 74 65 22 2c 22 70 61   ocktemplate","pa
0020  72 61 6d 73 22 3a 5b 5d 2c 22 69 64 22 3a 31 34   rams":[],"id":14
0030  30 31 31 38 35 39 33 30 34 33 39 7d               01185930439}

No.     Time           Source                Destination           Protocol Length Info
     59 0.319182000    10.0.0.40             10.0.0.13             TCP      1514   [TCP segment of a reassembled PDU]

Frame 59: 1514 bytes on wire (12112 bits), 1514 bytes captured (12112 bits) on interface 1
Ethernet II, Src: AsustekC_6d:7f:57 (c8:60:00:6d:7f:57), Dst: CadmusCo_93:05:23 (08:00:27:93:05:23)
Internet Protocol Version 4, Src: 10.0.0.40 (10.0.0.40), Dst: 10.0.0.13 (10.0.0.13)
Transmission Control Protocol, Src Port: 9333 (9333), Dst Port: 36473 (36473), Seq: 1, Ack: 189, Len: 1448
    Source port: 9333 (9333)
    Destination port: 36473 (36473)
    [Stream index: 5]
    Sequence number: 1    (relative sequence number)
    [Next sequence number: 1449    (relative sequence number)]
    Acknowledgment number: 189    (relative ack number)
    Header length: 32 bytes
    Flags: 0x010 (ACK)
    Window size value: 260
    [Calculated window size: 66560]
    [Window size scaling factor: 256]
    Checksum: 0xc37e [validation disabled]
    Options: (12 bytes), No-Operation (NOP), No-Operation (NOP), Timestamps
    [SEQ/ACK analysis]
    TCP segment data (1448 bytes)

No.     Time           Source                Destination           Protocol Length Info
     60 0.319186000    10.0.0.40             10.0.0.13             HTTP     1122   HTTP/1.1 200 OK  (application/json)

Frame 60: 1122 bytes on wire (8976 bits), 1122 bytes captured (8976 bits) on interface 1
Ethernet II, Src: AsustekC_6d:7f:57 (c8:60:00:6d:7f:57), Dst: CadmusCo_93:05:23 (08:00:27:93:05:23)
Internet Protocol Version 4, Src: 10.0.0.40 (10.0.0.40), Dst: 10.0.0.13 (10.0.0.13)
Transmission Control Protocol, Src Port: 9333 (9333), Dst Port: 36473 (36473), Seq: 1449, Ack: 189, Len: 1056
    Source port: 9333 (9333)
    Destination port: 36473 (36473)
    [Stream index: 5]
    Sequence number: 1449    (relative sequence number)
    [Next sequence number: 2505    (relative sequence number)]
    Acknowledgment number: 189    (relative ack number)
    Header length: 32 bytes
    Flags: 0x018 (PSH, ACK)
    Window size value: 260
    [Calculated window size: 66560]
    [Window size scaling factor: 256]
    Checksum: 0xa30b [validation disabled]
    Options: (12 bytes), No-Operation (NOP), No-Operation (NOP), Timestamps
    [SEQ/ACK analysis]
    TCP segment data (1056 bytes)
[2 Reassembled TCP Segments (2504 bytes): #59(1448), #60(1056)]
Hypertext Transfer Protocol
    HTTP/1.1 200 OK\r\n
    Date: Tue, 27 May 2014 10:18:50 +0000\r\n
    Connection: keep-alive\r\n
    Content-Length: 2327\r\n
    Content-Type: application/json\r\n
    Server: litecoin-json-rpc/v0.8.6.2-beta\r\n
    \r\n
    [HTTP response 1/1]
    [Time since request: 0.000312000 seconds]
    [Request in frame: 58]
JavaScript Object Notation: application/json

No.     Time           Source                Destination           Protocol Length Info
     69 0.320858000    10.0.0.13             10.0.0.40             HTTP     314    POST / HTTP/1.1 

Frame 69: 314 bytes on wire (2512 bits), 314 bytes captured (2512 bits) on interface 1
Ethernet II, Src: CadmusCo_93:05:23 (08:00:27:93:05:23), Dst: AsustekC_6d:7f:57 (c8:60:00:6d:7f:57)
Internet Protocol Version 4, Src: 10.0.0.13 (10.0.0.13), Dst: 10.0.0.40 (10.0.0.40)
Transmission Control Protocol, Src Port: 36474 (36474), Dst Port: 9333 (9333), Seq: 1, Ack: 1, Len: 248
    Source port: 36474 (36474)
    Destination port: 9333 (9333)
    [Stream index: 6]
    Sequence number: 1    (relative sequence number)
    [Next sequence number: 249    (relative sequence number)]
    Acknowledgment number: 1    (relative ack number)
    Header length: 32 bytes
    Flags: 0x018 (PSH, ACK)
    Window size value: 229
    [Calculated window size: 29312]
    [Window size scaling factor: 128]
    Checksum: 0xb954 [validation disabled]
    Options: (12 bytes), No-Operation (NOP), No-Operation (NOP), Timestamps
    [SEQ/ACK analysis]
Hypertext Transfer Protocol
    POST / HTTP/1.1\r\n
    Content-Length: 119\r\n
    Host: 10.0.0.40:9333\r\n
    Authorization: Basic dXNlcjpwYXNzd29yZA==\r\n
    Connection: keep-alive\r\n
    \r\n
    [Full request URI: http://10.0.0.40:9333/]
    [HTTP request 1/1]
    [Response in frame: 71]
    Data (119 bytes)

0000  7b 22 6d 65 74 68 6f 64 22 3a 22 67 65 74 62 6c   {"method":"getbl
0010  6f 63 6b 74 65 6d 70 6c 61 74 65 22 2c 22 70 61   ocktemplate","pa
0020  72 61 6d 73 22 3a 5b 7b 22 63 61 70 61 62 69 6c   rams":[{"capabil
0030  69 74 69 65 73 22 3a 5b 22 63 6f 69 6e 62 61 73   ities":["coinbas
0040  65 74 78 6e 22 2c 22 77 6f 72 6b 69 64 22 2c 22   etxn","workid","
0050  63 6f 69 6e 62 61 73 65 2f 61 70 70 65 6e 64 22   coinbase/append"
0060  5d 7d 5d 2c 22 69 64 22 3a 31 34 30 31 31 38 35   ]}],"id":1401185
0070  39 33 30 34 33 39 7d                              930439}

No.     Time           Source                Destination           Protocol Length Info
     70 0.321129000    10.0.0.40             10.0.0.13             TCP      1514   [TCP segment of a reassembled PDU]

Frame 70: 1514 bytes on wire (12112 bits), 1514 bytes captured (12112 bits) on interface 1
Ethernet II, Src: AsustekC_6d:7f:57 (c8:60:00:6d:7f:57), Dst: CadmusCo_93:05:23 (08:00:27:93:05:23)
Internet Protocol Version 4, Src: 10.0.0.40 (10.0.0.40), Dst: 10.0.0.13 (10.0.0.13)
Transmission Control Protocol, Src Port: 9333 (9333), Dst Port: 36474 (36474), Seq: 1, Ack: 249, Len: 1448
    Source port: 9333 (9333)
    Destination port: 36474 (36474)
    [Stream index: 6]
    Sequence number: 1    (relative sequence number)
    [Next sequence number: 1449    (relative sequence number)]
    Acknowledgment number: 249    (relative ack number)
    Header length: 32 bytes
    Flags: 0x010 (ACK)
    Window size value: 260
    [Calculated window size: 66560]
    [Window size scaling factor: 256]
    Checksum: 0x2592 [validation disabled]
    Options: (12 bytes), No-Operation (NOP), No-Operation (NOP), Timestamps
    [SEQ/ACK analysis]
    TCP segment data (1448 bytes)

No.     Time           Source                Destination           Protocol Length Info
     71 0.321133000    10.0.0.40             10.0.0.13             HTTP     1122   HTTP/1.1 200 OK  (application/json)

Frame 71: 1122 bytes on wire (8976 bits), 1122 bytes captured (8976 bits) on interface 1
Ethernet II, Src: AsustekC_6d:7f:57 (c8:60:00:6d:7f:57), Dst: CadmusCo_93:05:23 (08:00:27:93:05:23)
Internet Protocol Version 4, Src: 10.0.0.40 (10.0.0.40), Dst: 10.0.0.13 (10.0.0.13)
Transmission Control Protocol, Src Port: 9333 (9333), Dst Port: 36474 (36474), Seq: 1449, Ack: 249, Len: 1056
    Source port: 9333 (9333)
    Destination port: 36474 (36474)
    [Stream index: 6]
    Sequence number: 1449    (relative sequence number)
    [Next sequence number: 2505    (relative sequence number)]
    Acknowledgment number: 249    (relative ack number)
    Header length: 32 bytes
    Flags: 0x018 (PSH, ACK)
    Window size value: 260
    [Calculated window size: 66560]
    [Window size scaling factor: 256]
    Checksum: 0x051f [validation disabled]
    Options: (12 bytes), No-Operation (NOP), No-Operation (NOP), Timestamps
    [SEQ/ACK analysis]
    TCP segment data (1056 bytes)
[2 Reassembled TCP Segments (2504 bytes): #70(1448), #71(1056)]
Hypertext Transfer Protocol
    HTTP/1.1 200 OK\r\n
    Date: Tue, 27 May 2014 10:18:50 +0000\r\n
    Connection: keep-alive\r\n
    Content-Length: 2327\r\n
    Content-Type: application/json\r\n
    Server: litecoin-json-rpc/v0.8.6.2-beta\r\n
    \r\n
    [HTTP response 1/1]
    [Time since request: 0.000275000 seconds]
    [Request in frame: 69]
JavaScript Object Notation: application/json

No.     Time           Source                Destination           Protocol Length Info
     80 1.332273000    10.0.0.13             10.0.0.40             HTTP     314    POST / HTTP/1.1 

Frame 80: 314 bytes on wire (2512 bits), 314 bytes captured (2512 bits) on interface 1
Ethernet II, Src: CadmusCo_93:05:23 (08:00:27:93:05:23), Dst: AsustekC_6d:7f:57 (c8:60:00:6d:7f:57)
Internet Protocol Version 4, Src: 10.0.0.13 (10.0.0.13), Dst: 10.0.0.40 (10.0.0.40)
Transmission Control Protocol, Src Port: 36475 (36475), Dst Port: 9333 (9333), Seq: 1, Ack: 1, Len: 248
    Source port: 36475 (36475)
    Destination port: 9333 (9333)
    [Stream index: 7]
    Sequence number: 1    (relative sequence number)
    [Next sequence number: 249    (relative sequence number)]
    Acknowledgment number: 1    (relative ack number)
    Header length: 32 bytes
    Flags: 0x018 (PSH, ACK)
    Window size value: 229
    [Calculated window size: 29312]
    [Window size scaling factor: 128]
    Checksum: 0xcd7b [validation disabled]
    Options: (12 bytes), No-Operation (NOP), No-Operation (NOP), Timestamps
    [SEQ/ACK analysis]
Hypertext Transfer Protocol
    POST / HTTP/1.1\r\n
    Content-Length: 119\r\n
    Host: 10.0.0.40:9333\r\n
    Authorization: Basic dXNlcjpwYXNzd29yZA==\r\n
    Connection: keep-alive\r\n
    \r\n
    [Full request URI: http://10.0.0.40:9333/]
    [HTTP request 1/1]
    [Response in frame: 82]
    Data (119 bytes)

0000  7b 22 6d 65 74 68 6f 64 22 3a 22 67 65 74 62 6c   {"method":"getbl
0010  6f 63 6b 74 65 6d 70 6c 61 74 65 22 2c 22 70 61   ocktemplate","pa
0020  72 61 6d 73 22 3a 5b 7b 22 63 61 70 61 62 69 6c   rams":[{"capabil
0030  69 74 69 65 73 22 3a 5b 22 63 6f 69 6e 62 61 73   ities":["coinbas
0040  65 74 78 6e 22 2c 22 77 6f 72 6b 69 64 22 2c 22   etxn","workid","
0050  63 6f 69 6e 62 61 73 65 2f 61 70 70 65 6e 64 22   coinbase/append"
0060  5d 7d 5d 2c 22 69 64 22 3a 31 34 30 31 31 38 35   ]}],"id":1401185
0070  39 33 31 34 35 33 7d                              931453}

No.     Time           Source                Destination           Protocol Length Info
     81 1.332671000    10.0.0.40             10.0.0.13             TCP      1514   [TCP segment of a reassembled PDU]

Frame 81: 1514 bytes on wire (12112 bits), 1514 bytes captured (12112 bits) on interface 1
Ethernet II, Src: AsustekC_6d:7f:57 (c8:60:00:6d:7f:57), Dst: CadmusCo_93:05:23 (08:00:27:93:05:23)
Internet Protocol Version 4, Src: 10.0.0.40 (10.0.0.40), Dst: 10.0.0.13 (10.0.0.13)
Transmission Control Protocol, Src Port: 9333 (9333), Dst Port: 36475 (36475), Seq: 1, Ack: 249, Len: 1448
    Source port: 9333 (9333)
    Destination port: 36475 (36475)
    [Stream index: 7]
    Sequence number: 1    (relative sequence number)
    [Next sequence number: 1449    (relative sequence number)]
    Acknowledgment number: 249    (relative ack number)
    Header length: 32 bytes
    Flags: 0x010 (ACK)
    Window size value: 260
    [Calculated window size: 66560]
    [Window size scaling factor: 256]
    Checksum: 0x33bb [validation disabled]
    Options: (12 bytes), No-Operation (NOP), No-Operation (NOP), Timestamps
    [SEQ/ACK analysis]
    TCP segment data (1448 bytes)

No.     Time           Source                Destination           Protocol Length Info
     82 1.332675000    10.0.0.40             10.0.0.13             HTTP     1122   HTTP/1.1 200 OK  (application/json)

Frame 82: 1122 bytes on wire (8976 bits), 1122 bytes captured (8976 bits) on interface 1
Ethernet II, Src: AsustekC_6d:7f:57 (c8:60:00:6d:7f:57), Dst: CadmusCo_93:05:23 (08:00:27:93:05:23)
Internet Protocol Version 4, Src: 10.0.0.40 (10.0.0.40), Dst: 10.0.0.13 (10.0.0.13)
Transmission Control Protocol, Src Port: 9333 (9333), Dst Port: 36475 (36475), Seq: 1449, Ack: 249, Len: 1056
    Source port: 9333 (9333)
